{
  "schema": "longevity-skill/1",
  "name": "ageing-inflammatory-marker",
  "kind": "paper",
  "tier": "B",
  "species": [
    "human",
    "mouse"
  ],
  "evidence": "animal",
  "domains": [
    "免疫与炎症"
  ],
  "blurb_zh": "全血图一里的炎症基因，以及 MCU 和 MICU1。",
  "intents": [
    "immune_inflammation"
  ],
  "triage": {
    "reason_zh": "人全血转录组图一的炎症基因名单，脚本只查点名基因并附方向，不算分。",
    "reviewed": false
  },
  "paper": {
    "doi": "10.1038/s43587-023-00436-8",
    "title": "Reduced mitochondrial calcium uptake in macrophages is a major driver of inflammaging",
    "title_zh": "衰老相关的炎症标志",
    "journal": "Nature Aging",
    "year": 2023,
    "authors": "Seegren 等",
    "article_url": "https://www.nature.com/articles/s43587-023-00436-8",
    "supplements": [
      {
        "label": "补充表 MOESM4",
        "url": "https://media.springernature.com/original/springer-static/esm/art%3A10.1038%2Fs43587-023-00436-8/MediaObjects/43587_2023_436_MOESM4_ESM.xlsx"
      }
    ],
    "card_notes": [
      "论文没有给出代码仓库。"
    ],
    "summary_zh": "这项研究发现，小鼠巨噬细胞的线粒体吸钙能力随年龄下降，在小鼠和人的巨噬细胞里吸钙变弱都会放大炎症信号；人全血里两个负责吸钙的基因也随年龄变低。个人报告只核对你交来的基因是否在论文的炎症基因名单里，并写上论文的方向，不算分。",
    "summary_status": "draft"
  },
  "entry": {
    "script": "scripts/personal_report.py",
    "measurements_flag": "--measurements",
    "age_flag": "--age",
    "medications_flag": "--medications",
    "labs_flag": "--labs",
    "out_flag": "--out"
  },
  "inputs_status": "none"
}
